{
  "target_skill": "dev-graph:run-dev-graph-requirements",
  "args": "--repo-root /Users/dm/orca/workspaces/HarnessHub/wt-32/eval-log/dev-graph/live-trial-fixtures/20260802-wt32-requirements-review --feature-id F-LIVE-001 (package は fixture 内 system-plan/F-LIVE-001/ を skill が解決する)",
  "requested_model": "",
  "actual_model": [
    "claude-opus-4-6"
  ],
  "nudge_count": 0,
  "gate_response_count": 0,
  "goal_verdict": {
    "result": "PASS",
    "blockers": []
  },
  "invoked_skills": [
    "dev-graph:run-dev-graph-requirements"
  ],
  "missing_goal_seek_artifacts": [],
  "goal_seek_evidence_violations": [],
  "overall": {
    "launch": "PASS",
    "completion": "PASS",
    "goal_fit": "PASS",
    "verdict": "PASS"
  },
  "skill_dir_tree_sha": "8de39a43263bf9af52d895436a092256803adec59a82976666dfbdcf7a4d596c",
  "transcript_sha256": "83035730c9789dae4e482289dbe68fd40f521f9da6404c449a173fc9a4b2dc9e",
  "scenario_origin": "synthetic",
  "environment": {
    "claude_version": "2.1.62",
    "tmux": true,
    "transcript_layer": "jsonl",
    "permissions_mode": "bypassPermissions"
  },
  "tier": "live",
  "downgrade_reason": null,
  "timeline": {
    "boot_s": 5.0,
    "poll_exit": "DONE",
    "wall_clock_s": 660.0
  },
  "scenario_id": "C04-OUT1-positive-ready-handoff",
  "scenario_contract": {
    "scenario_file": "plugins/dev-graph/tests/fixtures/live-trial-positive-scenarios.json",
    "scenario_id": "C04-OUT1-positive-ready-handoff",
    "required_observations": [
      "a capability-build task-graph handoff is emitted for the exact-13 package",
      "the handoff remains bound to the feature and source digest",
      "the requirements skill generates no implementation source file"
    ],
    "observed": [
      {
        "index": 1,
        "observation": "a capability-build task-graph handoff is emitted for the exact-13 package",
        "evidence_ref": "independent-verification.json#/observations/handoff_emitted"
      },
      {
        "index": 2,
        "observation": "the handoff remains bound to the feature and source digest",
        "evidence_ref": "independent-verification.json#/observations/feature_digest_binding"
      },
      {
        "index": 3,
        "observation": "the requirements skill generates no implementation source file",
        "evidence_ref": "independent-verification.json#/observations/no_implementation_source"
      }
    ],
    "unobserved": [],
    "args_divergence": {
      "task_args_template": "--repo-root <contained-fixture-repo> --feature-id F-LIVE-001 (package は fixture 内 system-plan/F-LIVE-001/ を skill が解決する)",
      "template_flags": [
        "--feature-id",
        "--repo-root"
      ],
      "actual_flags": [
        "--feature-id",
        "--repo-root"
      ],
      "missing_flags": [],
      "extra_flags": [],
      "matches": true
    },
    "task_contract": {
      "declared": false,
      "task_file": "task.md",
      "task_file_exists": true,
      "required_fragments": [],
      "forbidden_fragments": [],
      "missing_required_fragments": [],
      "present_forbidden_fragments": [],
      "matches": true
    }
  }
}
