{
  "target_skill": "dev-graph:run-dev-graph-requirements",
  "args": "handoff --repo-root <fixture eval-log/dev-graph/live-trial-fixtures/20260721T232535rq-requirements> --feature-id F-LIVE-001 --package <fixture>/system-plan/F-LIVE-001/package.json",
  "requested_model": "",
  "actual_model": [
    "claude-opus-4-6"
  ],
  "nudge_count": 0,
  "gate_response_count": 0,
  "goal_verdict": {
    "result": "FAIL",
    "blockers": [
      "実走が成果物を 1 件も生成していない。fixture は git status クリーンで、全ファイルの mtime が fixture 生成時刻 2026-07-21T23:25:36 のまま (skill 実行は 23:26 以降)。SKILL の Output Contract が約束する requirements document・readiness matrix・capability-build/task-graph handoff のいずれも存在しない。",
      "status.json の handoff_emitted=true の根拠とされた system-plan/F-LIVE-001/system-build-handoff.json と task-graph.json は fixture の baseline commit 865f717 に含まれる既存ファイルであり、本実走の出力ではない。前者は \"kind\": \"system-build-handoff\"、registration_request.owner が system-dev-planner/C11 で、requirements skill が emit すべき capability-build 向け handoff ではない。runner は既存 fixture 資産を読んだだけで PASS と自己申告している。",
      "SKILL『ゴールシーク配線』が必須とする $DEV_GRAPH_ROOT/eval-log/run-dev-graph-requirements-goal-spec.json・-progress.json・-intermediate.jsonl が fixture 配下に 1 件も無い (fixture の eval-log ディレクトリは空)。『ゴールシーク検証』の hash 照合ブロックも未実行。同時刻の system-spec trial では fixture 内 eval-log に goal-spec/progress が生成されており、本実走のみ欠落している。",
      "digest 束縛の独自検証: package.json の source_feature_digest sha256:9ea5885dab34301e5feb131e8f54b5f10d95a658816c283d4747cc9f25ddf998 は自分で計算した結果 feature-context.json の sha256 と一致し system-build-handoff.json の identity とも整合するが、これは fixture baseline 内部の既存整合であり、本実走が生成した handoff が feature/digest に束縛された証拠にはならない。",
      "P01..P13 の DAG (線形・循環なし) も既存 task-graph.json / system-build-handoff.json 上で確認できるのみで、本実走の handoff に反映された事実はない。",
      "参考: リテラル Skill 呼び出し (transcript idx 55) は実施済み、C11 validate-graph-schema.py は --graph 付き再実行で exit 0 / valid=true、人手介入なし、実装ソース生成 0 件 (ただし何も生成していないため自明)。これらは満たすが、上記により skill description が約束する成果は未達。"
    ]
  },
  "overall": {
    "launch": "PASS",
    "completion": "PASS",
    "goal_fit": "FAIL",
    "verdict": "DEGRADED"
  },
  "skill_dir_tree_sha": "fe55b45b5f96f7850c69bd9f83b46acadc07bc008e7398fa4fe5fe72a19bd3fb",
  "transcript_sha256": "3eb3b37bbfc367176afe343463e581943f0378a330f87e4832f658b06efab0ed",
  "scenario_origin": "synthetic",
  "environment": {
    "claude_version": "2.1.62",
    "tmux": true,
    "transcript_layer": "jsonl",
    "permissions_mode": "bypassPermissions"
  },
  "tier": "live",
  "downgrade_reason": "goal-proxy 乖離 (完走するが目的を果たさない)",
  "timeline": {
    "boot_s": 5.0,
    "poll_exit": "0",
    "wall_clock_s": 255.0
  },
  "scenario_id": "C04-OUT1-positive-ready-handoff"
}
