{
  "target_skill": "dev-graph:run-dev-graph-system-spec",
  "args": "--repo-root /Users/dm/orca/workspaces/HarnessHub/wt-1/eval-log/dev-graph/live-trial-fixtures/system-spec-ci-c19-20260803",
  "requested_model": "",
  "actual_model": [
    "claude-opus-4-6"
  ],
  "nudge_count": 0,
  "gate_response_count": 0,
  "goal_verdict": {
    "result": "PASS",
    "blockers": []
  },
  "invoked_skills": [
    "dev-graph:run-dev-graph-node",
    "dev-graph:run-dev-graph-system-spec",
    "system-spec-harness:assign-system-spec-completeness-evaluator",
    "system-spec-harness:run-system-spec-compile",
    "system-spec-harness:run-system-spec-doc-fetch",
    "system-spec-harness:run-system-spec-elicit"
  ],
  "missing_goal_seek_artifacts": [],
  "goal_seek_evidence_violations": [],
  "overall": {
    "launch": "PASS",
    "completion": "PASS",
    "goal_fit": "PASS",
    "verdict": "PASS"
  },
  "skill_dir_tree_sha": "2f581516595ba7ff04333c61727bcd59f597742baa0aa35e200232849216b95e",
  "transcript_sha256": "7afaaec9ffe637e22f50cfaf81ad79e317ffb7b7b64c38ea9c270040e84cb139",
  "scenario_origin": "synthetic",
  "environment": {
    "claude_version": "2.1.62",
    "tmux": true,
    "transcript_layer": "jsonl",
    "permissions_mode": "bypassPermissions"
  },
  "tier": "live",
  "downgrade_reason": null,
  "timeline": {
    "boot_s": 4.0,
    "poll_exit": "DONE",
    "wall_clock_s": 1590.0
  },
  "scenario_id": "C19-OUT1-positive-system-spec-lineage",
  "scenario_contract": {
    "scenario_file": "plugins/dev-graph/tests/fixtures/live-trial-positive-scenarios.json",
    "scenario_id": "C19-OUT1-positive-system-spec-lineage",
    "required_observations": [
      "the declared system-spec-harness plugin is loaded and its canonical flow completes",
      "the imported specification and architecture retain source lineage and evaluator evidence",
      "registration occurs only through C02 and no duplicate elicitation or compile logic appears in dev-graph"
    ],
    "observed": [
      {
        "index": 1,
        "observation": "the declared system-spec-harness plugin is loaded and its canonical flow completes",
        "evidence_ref": "evidence/independent-verification.json#/observations/obs1_skill_delegation"
      },
      {
        "index": 2,
        "observation": "the imported specification and architecture retain source lineage and evaluator evidence",
        "evidence_ref": "evidence/independent-verification.json#/observations/obs2_source_lineage"
      },
      {
        "index": 3,
        "observation": "registration occurs only through C02 and no duplicate elicitation or compile logic appears in dev-graph",
        "evidence_ref": "evidence/independent-verification.json#/observations/obs3_validation_scripts"
      }
    ],
    "unobserved": [],
    "args_divergence": {
      "task_args_template": "--repo-root <contained-fixture-repo>",
      "template_flags": [
        "--repo-root"
      ],
      "actual_flags": [
        "--repo-root"
      ],
      "missing_flags": [],
      "extra_flags": [],
      "matches": true
    },
    "task_contract": {
      "declared": false,
      "task_file": "task.md",
      "task_file_exists": true,
      "required_fragments": [],
      "forbidden_fragments": [],
      "missing_required_fragments": [],
      "present_forbidden_fragments": [],
      "matches": true
    }
  }
}
