{
  "target_skill": "dev-graph:run-dev-graph-decompose",
  "args": "社内向けの業務ポータルを作りたい。利用者は自分のアカウントでログインでき、ログイン後のダッシュボードで自分に割り当てられた作業と期限を一覧できる。期限が近い作業は通知として届き、管理者は全社の進捗を集計したレポートを閲覧できる。 --repo-root /Users/dm/orca/workspaces/HarnessHub/wt-29-2/eval-log/dev-graph/run-dev-graph-decompose/live-trial/20260806T010000Z-f84o-postmain-c14/fixture-repo",
  "requested_model": "",
  "actual_model": [
    "claude-opus-4-6"
  ],
  "nudge_count": 0,
  "gate_response_count": 0,
  "goal_verdict": {
    "result": "PASS",
    "blockers": []
  },
  "invoked_skills": [
    "dev-graph:run-dev-graph-decompose"
  ],
  "missing_goal_seek_artifacts": [],
  "goal_seek_evidence_violations": [],
  "overall": {
    "launch": "PASS",
    "completion": "PASS",
    "goal_fit": "PASS",
    "verdict": "PASS"
  },
  "skill_dir_tree_sha": "79649629ca85614d8aea6a67192a3dbdcf6277ab44272f7d09696aed6bdde5dd",
  "transcript_sha256": "a7144ab57c6ec05f9c0e212423aa15e7203f9b866f1c3d85082bde4431f14bd6",
  "scenario_origin": "synthetic",
  "environment": {
    "claude_version": "2.1.62",
    "tmux": true,
    "transcript_layer": "jsonl",
    "permissions_mode": "bypassPermissions"
  },
  "tier": "live",
  "downgrade_reason": null,
  "timeline": {
    "boot_s": null,
    "poll_exit": "DONE",
    "wall_clock_s": 725.0
  },
  "scenario_id": "C14-OUT1-positive-macro-decomposition-r9",
  "scenario_contract": {
    "scenario_file": "plugins/dev-graph/tests/fixtures/live-trial-positive-scenarios.json",
    "scenario_id": "C14-OUT1-positive-macro-decomposition-r9",
    "required_observations": [
      "the produced feature and architecture nodes form an acyclic DAG whose inter-feature depends_on stays within declared_granularity_threshold.max_value measured by declared_granularity_threshold.metric",
      "in a run that writes for real, pre-evaluation draft features publish zero issues, and every zero carries the reason it is zero, so suppression by the draft gate is never reported interchangeably with a binding route the configuration disables or with the absence of a live candidate",
      "at least one actual produced draft feature remains excluded while one actual produced feature advanced to confirmed, evaluation-pass and readiness-complete becomes the sole publication candidate, so the exclusion is a decision of the implementation publication gate and not a side effect of a run that wrote nothing anywhere",
      "the beads and none bindings are exercised as two separate runs whose recorded publication routes differ, while the github binding is recorded as unreachable for a macro-only run together with the schema rule that makes it unreachable, and every binding's figure is derived from the tracker binding actually persisted in the run's graph rather than from an argument supplied to the audit, so no binding's measurement is one value restated from the audit's own input",
      "the local, Beads, GitHub and Projects write counts are derived by differencing repository state captured before and after the run rather than restated from the skill's own report, and the preview graph is validated through the stdin path so no temporary file is created inside the managed repository",
      "the confirmation_evidence of every promoted feature is recomputed from the final persisted node content excluding only confirmation_evidence and matches, so a placeholder digest or a node edited after evaluation is rejected",
      "gate violations synthesised from this run's final graph are rejected by the canonical schema validator, so the publication gate is falsifiable on the same data rather than inferred from a run where no forbidden publication happened"
    ],
    "observed": [
      {
        "index": 1,
        "observation": "the produced feature and architecture nodes form an acyclic DAG whose inter-feature depends_on stays within declared_granularity_threshold.max_value measured by declared_granularity_threshold.metric",
        "evidence_ref": "independent-verification.json#/observations/1"
      },
      {
        "index": 2,
        "observation": "in a run that writes for real, pre-evaluation draft features publish zero issues, and every zero carries the reason it is zero, so suppression by the draft gate is never reported interchangeably with a binding route the configuration disables or with the absence of a live candidate",
        "evidence_ref": "independent-verification.json#/observations/2"
      },
      {
        "index": 3,
        "observation": "at least one actual produced draft feature remains excluded while one actual produced feature advanced to confirmed, evaluation-pass and readiness-complete becomes the sole publication candidate, so the exclusion is a decision of the implementation publication gate and not a side effect of a run that wrote nothing anywhere",
        "evidence_ref": "independent-verification.json#/observations/3"
      },
      {
        "index": 4,
        "observation": "the beads and none bindings are exercised as two separate runs whose recorded publication routes differ, while the github binding is recorded as unreachable for a macro-only run together with the schema rule that makes it unreachable, and every binding's figure is derived from the tracker binding actually persisted in the run's graph rather than from an argument supplied to the audit, so no binding's measurement is one value restated from the audit's own input",
        "evidence_ref": "independent-verification.json#/observations/4"
      },
      {
        "index": 5,
        "observation": "the local, Beads, GitHub and Projects write counts are derived by differencing repository state captured before and after the run rather than restated from the skill's own report, and the preview graph is validated through the stdin path so no temporary file is created inside the managed repository",
        "evidence_ref": "independent-verification.json#/observations/5"
      },
      {
        "index": 6,
        "observation": "the confirmation_evidence of every promoted feature is recomputed from the final persisted node content excluding only confirmation_evidence and matches, so a placeholder digest or a node edited after evaluation is rejected",
        "evidence_ref": "independent-verification.json#/observations/6"
      },
      {
        "index": 7,
        "observation": "gate violations synthesised from this run's final graph are rejected by the canonical schema validator, so the publication gate is falsifiable on the same data rather than inferred from a run where no forbidden publication happened",
        "evidence_ref": "independent-verification.json#/observations/7"
      }
    ],
    "unobserved": [],
    "args_divergence": {
      "task_args_template": "<want> --repo-root <contained-fixture-repo>",
      "template_flags": [
        "--repo-root"
      ],
      "actual_flags": [
        "--repo-root"
      ],
      "missing_flags": [],
      "extra_flags": [],
      "matches": true
    },
    "task_contract": {
      "declared": true,
      "task_file": "task.md",
      "task_file_exists": true,
      "required_fragments": [
        "upsert-node.py --input",
        "confirmation_status",
        "evaluation_status",
        "implementation_readiness",
        "confirmation_evidence",
        "evaluated_digest",
        "sort_keys=True",
        "separators=(',', ':')"
      ],
      "forbidden_fragments": [
        "--operation apply-lifecycle-request"
      ],
      "missing_required_fragments": [],
      "present_forbidden_fragments": [],
      "matches": true
    }
  }
}
