{
  "target_skill": "dev-graph:run-dev-graph-node",
  "args": "",
  "requested_model": "",
  "actual_model": [
    "claude-opus-4-6"
  ],
  "nudge_count": 0,
  "gate_response_count": 0,
  "goal_verdict": {
    "result": "PASS",
    "blockers": []
  },
  "invoked_skills": [
    "dev-graph:run-dev-graph-node"
  ],
  "missing_goal_seek_artifacts": [],
  "goal_seek_evidence_violations": [],
  "overall": {
    "launch": "PASS",
    "completion": "PASS",
    "goal_fit": "PASS",
    "verdict": "PASS"
  },
  "skill_dir_tree_sha": "1e95681e56b0e4446dbd9cd8724bd2722cc7e268da50e2b0984ac6eb37cdf74a",
  "transcript_sha256": "998fed24040483f198d400b1836c352d5c049a107ba831c1cd8644ed65005559",
  "scenario_origin": "synthetic",
  "environment": {
    "claude_version": "2.1.62",
    "tmux": true,
    "transcript_layer": "jsonl",
    "permissions_mode": "bypassPermissions"
  },
  "tier": "live",
  "downgrade_reason": null,
  "timeline": {
    "boot_s": null,
    "poll_exit": "DONE",
    "wall_clock_s": null
  },
  "scenario_id": "C02-OUT1-positive-mixed-artifacts"
}
