{
  "target_skill": "dev-graph:run-dev-graph-system-spec",
  "args": "--repo-root /Users/dm/dev/dev/個人開発/HarnessHub/.worktrees/task-20260716-154821-wt-1/eval-log/dev-graph/live-trial-fixtures/r3-system-spec",
  "requested_model": "",
  "actual_model": [
    "claude-opus-4-6"
  ],
  "nudge_count": 0,
  "gate_response_count": 0,
  "goal_verdict": {
    "result": "PASS",
    "blockers": []
  },
  "overall": {
    "launch": "PASS",
    "completion": "PASS",
    "goal_fit": "PASS",
    "verdict": "PASS"
  },
  "skill_dir_tree_sha": "18b490c0aa4afb7734e88cc86ca2cf27c2038bc9aa41b71e5fa440497439b1c8",
  "transcript_sha256": "07ecc2113bdee3c5a1bbd665c1445751eb3845b0c995cc7151bdf4d6586c0d8d",
  "scenario_origin": "replay",
  "environment": {
    "claude_version": "2.1.62",
    "tmux": true,
    "transcript_layer": "jsonl",
    "permissions_mode": "bypassPermissions"
  },
  "tier": "live",
  "downgrade_reason": null,
  "timeline": {
    "boot_s": 5.0,
    "poll_exit": "DONE",
    "wall_clock_s": 1005.0
  },
  "scenario_id": "C19-OUT1-positive-system-spec-lineage"
}
