{
  "target_skill": "dev-graph:run-dev-graph-system-spec",
  "args": "--repo-root /Users/dm/dev/dev/個人開発/HarnessHub/.worktrees/task-20260728-082322-wt-11/eval-log/dev-graph/live-trial-fixtures/system-spec-lp36-merged",
  "requested_model": "",
  "actual_model": [
    "claude-opus-4-6"
  ],
  "nudge_count": 0,
  "gate_response_count": 0,
  "goal_verdict": {
    "result": "FAIL",
    "blockers": []
  },
  "invoked_skills": [
    "dev-graph:run-dev-graph-system-spec",
    "system-spec-harness:assign-system-spec-completeness-evaluator",
    "system-spec-harness:run-system-spec-compile",
    "system-spec-harness:run-system-spec-doc-fetch",
    "system-spec-harness:run-system-spec-elicit"
  ],
  "missing_goal_seek_artifacts": [],
  "goal_seek_evidence_violations": [],
  "overall": {
    "launch": "PASS",
    "completion": "PASS",
    "goal_fit": "FAIL",
    "verdict": "DEGRADED"
  },
  "skill_dir_tree_sha": "bc70aee900dc093bfea35eaab6bb89fb5e3473c4be1a722f77c7644bb863edd6",
  "transcript_sha256": "a43da0ab3825f246124025b8b55b9d06674548db77a629453418412e692ddabd",
  "scenario_origin": "synthetic",
  "environment": {
    "claude_version": "2.1.62",
    "tmux": true,
    "transcript_layer": "jsonl",
    "permissions_mode": "dangerously-skip-permissions"
  },
  "tier": "live",
  "downgrade_reason": "goal-proxy 乖離 (完走するが目的を果たさない)",
  "timeline": {
    "boot_s": 8.0,
    "poll_exit": "DONE",
    "wall_clock_s": 1740.0
  },
  "scenario_id": "C19-OUT1-positive-system-spec-lineage"
}
