{
  "target_skill": "dev-graph:run-dev-graph-decompose",
  "args": "--repo-root /Users/dm/dev/dev/個人開発/HarnessHub/.worktrees/task-20260724-203623-wt-8/eval-log/dev-graph/live-trial-fixtures/20260725-codex-decompose --binding none --dry-run",
  "requested_model": "",
  "actual_model": [
    "claude-opus-4-6"
  ],
  "nudge_count": 0,
  "gate_response_count": 0,
  "goal_verdict": {
    "result": "FAIL",
    "blockers": [
      "stdin validator returned valid:false because preview artifacts were missing; fail-closed handling was not respected",
      "required Agent subagent fork was not performed",
      "intermediate.jsonl second row was added with Edit instead of append-only write",
      "fixture want was not resolved and a synthetic want was invented"
    ]
  },
  "invoked_skills": [
    "dev-graph:run-dev-graph-decompose"
  ],
  "missing_goal_seek_artifacts": [],
  "goal_seek_evidence_violations": [],
  "overall": {
    "launch": "PASS",
    "completion": "PASS",
    "goal_fit": "FAIL",
    "verdict": "DEGRADED"
  },
  "skill_dir_tree_sha": "b30107b507ee0e99b18dea12a5b2290d599097dd05e5fb7baf13027f79c680b9",
  "transcript_sha256": "dd3958ece21871ad6f7498c059e4966acab12958d10fa464736f6386ec7bfa67",
  "scenario_origin": "synthetic",
  "environment": {
    "claude_version": "2.1.62",
    "tmux": true,
    "transcript_layer": "jsonl",
    "permissions_mode": "bypassPermissions"
  },
  "tier": "live",
  "downgrade_reason": "goal-proxy 乖離 (完走するが目的を果たさない)",
  "timeline": {
    "boot_s": 4.0,
    "poll_exit": "DONE",
    "wall_clock_s": 570.0
  },
  "scenario_id": "C14-OUT1-positive-macro-decomposition"
}
