{
  "target_skill": "dev-graph:run-dev-graph-requirements",
  "args": "",
  "requested_model": "",
  "actual_model": [
    "claude-opus-4-6"
  ],
  "nudge_count": 0,
  "gate_response_count": 0,
  "goal_verdict": {
    "result": "PASS",
    "blockers": []
  },
  "invoked_skills": [
    "dev-graph:run-dev-graph-requirements"
  ],
  "missing_goal_seek_artifacts": [],
  "goal_seek_evidence_violations": [],
  "overall": {
    "launch": "PASS",
    "completion": "PASS",
    "goal_fit": "PASS",
    "verdict": "PASS"
  },
  "skill_dir_tree_sha": "08088d9d467bcae6025472f9ed6b16bd4e666413b302a48c8f8f269de3ff892e",
  "transcript_sha256": "c87de89463873de39b6c7f72561878ed92807b7cc2aff2b6dca66eb7af109a3e",
  "scenario_origin": "synthetic",
  "environment": {
    "claude_version": "2.1.62",
    "tmux": true,
    "transcript_layer": "jsonl",
    "permissions_mode": "bypassPermissions"
  },
  "tier": "live",
  "downgrade_reason": null,
  "timeline": {
    "boot_s": null,
    "poll_exit": "DONE",
    "wall_clock_s": null
  },
  "scenario_id": "C04-OUT1-positive-ready-handoff"
}
