{
  "target_skill": "dev-graph:run-dev-graph-init",
  "args": "--repo-root <contained-fixture-repo> --hook-source plugin",
  "requested_model": "",
  "actual_model": [
    "claude-opus-4-6"
  ],
  "nudge_count": 0,
  "gate_response_count": 0,
  "goal_verdict": {
    "result": "PASS",
    "blockers": []
  },
  "invoked_skills": [
    "dev-graph:run-dev-graph-init"
  ],
  "missing_goal_seek_artifacts": [],
  "goal_seek_evidence_violations": [],
  "overall": {
    "launch": "PASS",
    "completion": "PASS",
    "goal_fit": "PASS",
    "verdict": "PASS"
  },
  "skill_dir_tree_sha": "bde90f18c9afa9fa3ad7bd0024e5d5caafd9f7b1a2a885e7679e5d41ededd4e2",
  "transcript_sha256": "486d923bd5555777eb592a99953a7f04328f3b3ea94aeb8910928903dac5e171",
  "scenario_origin": "synthetic",
  "environment": {
    "claude_version": "2.1.62",
    "tmux": true,
    "transcript_layer": "jsonl",
    "permissions_mode": "bypassPermissions"
  },
  "tier": "live",
  "downgrade_reason": null,
  "timeline": {
    "boot_s": 4.0,
    "poll_exit": "DONE",
    "wall_clock_s": 510.0
  },
  "scenario_id": "C01-OUT1-positive-idempotence-r17"
}
