{
  "target_skill": "dev-graph:run-dev-graph-system-spec",
  "args": "--repo-root /private/tmp/harnesshub-o4zi.Gv5hFK/eval-log/dev-graph/run-dev-graph-system-spec/live-trial/20260808T154500Z-o4zi-c19r3/fixture-repo",
  "requested_model": "claude-opus-5",
  "actual_model": [
    "claude-opus-5"
  ],
  "nudge_count": 0,
  "gate_response_count": 0,
  "goal_verdict": {
    "result": "PASS",
    "blockers": []
  },
  "invoked_skills": [
    "dev-graph:run-dev-graph-system-spec",
    "system-spec-harness:assign-system-spec-completeness-evaluator",
    "system-spec-harness:run-system-spec-compile",
    "system-spec-harness:run-system-spec-doc-fetch",
    "system-spec-harness:run-system-spec-elicit"
  ],
  "missing_goal_seek_artifacts": [],
  "goal_seek_evidence_violations": [],
  "overall": {
    "launch": "PASS",
    "completion": "PASS",
    "goal_fit": "PASS",
    "verdict": "PASS"
  },
  "skill_dir_tree_sha": "d090d08557e35d65477b10fc7d6f692f0f1b1b146abf8a200dbc1fc78e1832f2",
  "transcript_sha256": "17cfb261ff971541d8fdd22f3d3694a27e6b3f4b367317b0f9df49ce7d5b0ab4",
  "scenario_origin": "synthetic",
  "environment": {
    "claude_version": "2.1.62",
    "tmux": true,
    "transcript_layer": "jsonl",
    "permissions_mode": "bypassPermissions"
  },
  "tier": "live",
  "downgrade_reason": null,
  "timeline": {
    "boot_s": null,
    "poll_exit": "DONE",
    "wall_clock_s": 2025.0
  },
  "scenario_id": "C19-OUT1-positive-system-spec-lineage-r2",
  "scenario_contract": {
    "scenario_file": "plugins/dev-graph/tests/fixtures/live-trial-positive-scenarios.json",
    "scenario_id": "C19-OUT1-positive-system-spec-lineage-r2",
    "required_observations": [
      "the declared system-spec-harness plugin is loaded and its canonical flow completes",
      "the imported specification and architecture retain source lineage and evaluator evidence",
      "registration occurs only through C02 and no duplicate elicitation or compile logic appears in dev-graph"
    ],
    "observed": [
      {
        "index": 1,
        "observation": "the declared system-spec-harness plugin is loaded and its canonical flow completes",
        "evidence_ref": "independent-verification.json"
      },
      {
        "index": 2,
        "observation": "the imported specification and architecture retain source lineage and evaluator evidence",
        "evidence_ref": "independent-verification.json"
      },
      {
        "index": 3,
        "observation": "registration occurs only through C02 and no duplicate elicitation or compile logic appears in dev-graph",
        "evidence_ref": "independent-verification.json"
      }
    ],
    "unobserved": [],
    "args_divergence": {
      "task_args_template": "--repo-root <contained-fixture-repo>",
      "template_flags": [
        "--repo-root"
      ],
      "actual_flags": [
        "--repo-root"
      ],
      "missing_flags": [],
      "extra_flags": [],
      "matches": true
    },
    "task_contract": {
      "declared": true,
      "task_file": "task.md",
      "task_file_exists": true,
      "required_fragments": [
        "upsert-node.py",
        "SYSTEM_SPEC_AUDIT_FORK_LEDGER",
        "doc-fetch は公式ページを実取得して現行 version を記録する",
        "この一致を理由に FAIL にしてはいけません"
      ],
      "forbidden_fragments": [],
      "missing_required_fragments": [],
      "present_forbidden_fragments": [],
      "matches": true
    }
  }
}
