{
  "target_skill": "dev-graph:run-dev-graph-sync",
  "args": "",
  "requested_model": "",
  "actual_model": [
    "claude-opus-4-6"
  ],
  "nudge_count": 0,
  "gate_response_count": 0,
  "goal_verdict": {
    "result": "PASS",
    "blockers": []
  },
  "overall": {
    "launch": "PASS",
    "completion": "PASS",
    "goal_fit": "PASS",
    "verdict": "PASS"
  },
  "skill_dir_tree_sha": "496d2f7fcb8d98caaf4933ce12de14b54aca8d51bf1ca4b866b9489761b149c2",
  "transcript_sha256": "fc7a6e5d47aaf678c3dbc13ac6102702f97695d23e4f4c82d86b0c844040108a",
  "scenario_origin": "synthetic",
  "environment": {
    "claude_version": "2.1.62",
    "tmux": true,
    "transcript_layer": "jsonl",
    "permissions_mode": "bypassPermissions"
  },
  "tier": "live",
  "downgrade_reason": null,
  "timeline": {
    "boot_s": null,
    "poll_exit": "DONE",
    "wall_clock_s": 375.0
  },
  "scenario_id": "C03-OUT1-positive-second-sync-zero"
}
