{
  "target_skill": "dev-graph:run-dev-graph-sync",
  "args": "",
  "requested_model": "",
  "actual_model": [
    "claude-opus-4-6"
  ],
  "nudge_count": 0,
  "gate_response_count": 0,
  "goal_verdict": {
    "result": "PASS",
    "blockers": []
  },
  "invoked_skills": [
    "dev-graph:run-dev-graph-sync"
  ],
  "missing_goal_seek_artifacts": [],
  "goal_seek_evidence_violations": [],
  "overall": {
    "launch": "PASS",
    "completion": "PASS",
    "goal_fit": "PASS",
    "verdict": "PASS"
  },
  "skill_dir_tree_sha": "fff8102d480ea9b00080cc78f0bbdd8d534b0a7ab7acb87e57716de2c37d4aba",
  "transcript_sha256": "ceb290b08d631f09d1d00f0a7e99655ab5cdc92278a1d142a4fe1e5da4f68186",
  "scenario_origin": "synthetic",
  "environment": {
    "claude_version": "2.1.62",
    "tmux": true,
    "transcript_layer": "jsonl",
    "permissions_mode": "bypassPermissions"
  },
  "tier": "live",
  "downgrade_reason": null,
  "timeline": {
    "boot_s": 5.0,
    "poll_exit": "DONE",
    "wall_clock_s": 270.0
  },
  "scenario_id": "C03-OUT1-positive-second-sync-zero"
}
